{"slug":"biostats-dev-ggsurveillance","name":"ggsurveillance","what_it_is":"An R package providing ggplot2 extensions and tidy utility functions for infectious disease surveillance and outbreak investigation. Adds epidemic curve geoms, date aggregation helpers, and epidemiological visualizations.","components":["geom_epicurve()","stat_bin_date()","geom_vline_year()","bin_by_date()","align_dates_seasonal()","geom_bar_diverging()/geom_area_diverging()","geom_epigantt()","guide_axis_nested_date()","theme_mod functions","create_agegroups()"],"protocols":["ggplot2 extension API","ISO week date standard","CRAN distribution"],"measurement":["Case counts per date bin","Seasonal incidence summaries","Population demographics","Exposure interval durations"],"modes":["Epidemic curve mode","Seasonal overlay mode","Epigantt mode","Diverging chart mode"],"constraints":["R with ggplot2/tidyverse required","Date binning locale-dependent","geom_epigantt requires long format","Experimental lifecycle; API may break"],"docker_services":[],"notable_absences":["No data ingestion from surveillance DBs","No statistical modelling","No interactive output","No spatial/map geoms"],"configuration":[],"fault_injection":[]}