{"slug":"dhis2-analytics","name":"dhis2/analytics","what_it_is":"A shared React component and utility library (@dhis2/analytics) powering DHIS2 analytics apps (dashboards, data visualizer, maps, line listing). Provides reusable UI components, layout modules, visualization builders, and API helpers.","components":["DataDimension/PeriodDimension/OrgUnitDimension","DimensionsPanel with drag-and-drop","PivotTable","FileMenu (Save/SaveAs/Rename/Delete)","InterpretationsUnit","VisualizationOptions","DashboardPluginWrapper","CachedDataQueryProvider"],"protocols":["DHIS2 Web API (REST)","npm registry","Semantic Release/Conventional Commits"],"measurement":[],"modes":["Column/Bar/Line/Area/Pie/Radar/Gauge/Bubble charts","Year-over-year","Single value","Pivot table","Scatter plot","Line list","Outlier table"],"constraints":["Host app must supply all peer dependencies","Branch versioning restricts bump types","Dual DnD library dependency","Chart rendering delegates to Highcharts (license applies)","Multi-calendar requires @dhis2/multi-calendar-dates","API helpers need live DHIS2 instance"],"docker_services":[],"notable_absences":["No standalone server","No built-in charting engine","No Docker","No auth logic"],"configuration":[],"fault_injection":[]}