{"slug":"imi-muenster-openedc","name":"OpenEDC","what_it_is":"A browser-based electronic data capture (EDC) system for medical research studies, built on the CDISC ODM-XML standard with no framework dependencies. Unmaintained prototype archived March 2025; successor at openedc.health.","components":["Metadata design module","Clinical data capture module","Administrative module (server-connected only)","Service worker (offline support)","Internationalization layer","Optional OpenEDC Server backend"],"protocols":["CDISC ODM-XML","AES encryption (local storage)","End-to-end encryption (client-server)"],"measurement":["Real-time validation","Conditional skip patterns"],"configuration":["Optional server URL for multi-user mode","Offline-first; auto-sync on reconnection"],"modes":["Standalone (fully offline, local storage)","Server-connected (multi-user/multi-site sync)"],"constraints":["Archived read-only March 2025; no maintenance","Unmaintained prototype; not GCP-compliant","Admin features require running OpenEDC Server"],"docker_services":[],"notable_absences":["No Docker","No build step or bundler","No REST API spec published"],"fault_injection":[]}